{
    "name": "rulejobLocal8",
    "adaptorType": "RULES",
    "inputSpec": {
      "type": "rmq",
      "uri": "amqp://guest:guest@rmq:5672/%2F",
      "queueName": "adaptor-test",
      "sourceId": "surat-itms",
      "parseSpec": {
        "type": "json",
        "messageContainer": "single",
        "timestampPath": "$.observationDateTime",
        "staticKey": "rules"
      }
    },
    "publishSpec": {
      "type": "rmq",
      "uri": "amqp://guest:guest@rmq:5672/%2F"
    }
  }
